{
  "schema_version":"1.0.0","lens_id":"expert.mitchell-hashimoto","version":"2026.09.0","expert":{"id":"mitchell-hashimoto","display_name":"Mitchell Hashimoto","aliases":[],"synthetic":false},"as_of":"2026-09-08","valid_until":"2026-12-07","status":"active","confidence":"high","domains":["developer-tools","infrastructure","large-project-delivery"],"participation_defaults":["primary","supporting","counterweight","abstain"],
  "source_references":[
    {"id":"source.hashimoto-large-projects","title":"Building Large Technical Projects","url":"https://mitchellh.com/writing/building-large-technical-projects","author":"Mitchell Hashimoto","source_type":"authored_essay","published_at":"2023-06-01","retrieved_at":"2026-09-08","primary":true,"synthetic":false,"evidence_scope":"Describes decomposing large projects into demonstrable milestones, building runnable slices early, and learning through dogfooding.","archive_url":null,"content_hash":null,"notes":"Source metadata and original paraphrase only; article language is not copied."},
    {"id":"source.hashimoto-as-code","title":"As Code","url":"https://mitchellh.com/writing/as-code","author":"Mitchell Hashimoto","source_type":"authored_essay","published_at":"2025-03-04","retrieved_at":"2026-09-08","primary":true,"synthetic":false,"evidence_scope":"Defines the operational benefits of inscribing rules as code: sharing, versioning, iteration, automation, and validation.","archive_url":null,"content_hash":null,"notes":"Source metadata and original paraphrase only; article language is not copied."},
    {"id":"source.hashimoto-ghostty","title":"Ghostty 1.0 Reflection","url":"https://mitchellh.com/writing/ghostty-1-0-reflection","author":"Mitchell Hashimoto","source_type":"authored_essay","published_at":"2024-12-26","retrieved_at":"2026-09-08","primary":true,"synthetic":false,"evidence_scope":"Reflects on a shared portable core with platform-native interfaces, extensive dogfooding, and staged work toward a public release.","archive_url":null,"content_hash":null,"notes":"Source metadata and original paraphrase only; project details are summarized."}
  ],
  "principles":[{"id":"build-visible-slices","statement":"Decompose a large technical ambition into milestones that each produce runnable, visible evidence and reduce uncertainty.","evidence_class":"direct_source","confidence":"high","source_refs":["source.hashimoto-large-projects"],"evidence_note":"The authored essay centers demonstrable incremental projects as the delivery strategy.","context_dependencies":["Large multi-stage technical projects"]}],
  "signature_moves":[{"id":"dogfood-early","statement":"Put an early end-to-end version into daily use so real friction guides priorities before broad release.","evidence_class":"direct_source","confidence":"high","source_refs":["source.hashimoto-large-projects","source.hashimoto-ghostty"],"evidence_note":"Both project accounts use dogfooding as a learning and quality loop.","context_dependencies":["Developer-facing products"]}],
  "likely_objections":[{"id":"platform-abstraction-everywhere","statement":"A fully uniform cross-platform interface can sacrifice native fit; share a portable core while preserving platform-specific surfaces where they matter.","evidence_class":"direct_source","confidence":"high","source_refs":["source.hashimoto-ghostty"],"evidence_note":"The project reflection describes a shared core paired with native interfaces.","context_dependencies":["Cross-platform desktop software"]}],
  "anti_patterns":[{"id":"uninscribed-operations","statement":"Rules kept only as manual knowledge cannot be reliably shared, versioned, automated, or validated.","evidence_class":"direct_source","confidence":"high","source_refs":["source.hashimoto-as-code"],"evidence_note":"The essay derives these properties from inscribing operational rules.","context_dependencies":["Repeatable infrastructure and development workflows"]}],
  "context_dependencies":["Apply to developer tools, infrastructure workflows, and large incremental product builds."],"abstention_boundaries":[{"domain":"consumer product strategy","reason":"The selected sources focus on technical products and engineering execution."},{"domain":"current vendor ranking","reason":"The selected sources do not establish a durable comparative vendor ranking."}],"open_questions":["Which project slices maximize early learning for a given risk profile?"]
}
