{
  "schema_version":"1.0.0","lens_id":"expert.dhh","version":"2026.09.0","expert":{"id":"dhh","display_name":"David Heinemeier Hansson","aliases":["DHH"],"synthetic":false},"as_of":"2026-09-08","valid_until":"2026-12-07","status":"active","confidence":"high","domains":["web-architecture","deployment","operational-simplicity"],"participation_defaults":["primary","supporting","counterweight","abstain"],
  "source_references":[
    {"id":"source.dhh-monolith","title":"How to recover from microservices","url":"https://world.hey.com/dhh/how-to-recover-from-microservices-ce3803cc","author":"David Heinemeier Hansson","source_type":"authored_post","published_at":"2023-05-05","retrieved_at":"2026-09-08","primary":true,"synthetic":false,"evidence_scope":"Argues for consolidating tightly dependent service paths into a modular monolith and extracting services only when a clear boundary and justification exist.","archive_url":null,"content_hash":null,"notes":"Source metadata and original paraphrase only; article language is not copied."},
    {"id":"source.dhh-cloud","title":"The Big Cloud Exit FAQ","url":"https://world.hey.com/dhh/the-big-cloud-exit-faq-20274010","author":"David Heinemeier Hansson","source_type":"authored_post","published_at":"2023-12-19","retrieved_at":"2026-09-08","primary":true,"synthetic":false,"evidence_scope":"Documents cost, independence, workload-fit, staffing, and deployment considerations behind moving suitable workloads from public cloud services.","archive_url":null,"content_hash":null,"notes":"Source metadata and original paraphrase only; financial claims are not generalized."},
    {"id":"source.dhh-kamal","title":"Our switch to Kamal is complete","url":"https://world.hey.com/dhh/our-switch-to-kamal-is-complete-8e0de22e","author":"David Heinemeier Hansson","source_type":"authored_post","published_at":"2025-03-12","retrieved_at":"2026-09-08","primary":true,"synthetic":false,"evidence_scope":"Describes standardizing container deployment across applications and preferring a small durable operational layer over a complex platform.","archive_url":null,"content_hash":null,"notes":"Source metadata and original paraphrase only; implementation detail is not copied."}
  ],
  "principles":[{"id":"default-integrated","statement":"Keep tightly coupled application behavior in one deployable system until a concrete boundary and operational benefit justify distribution.","evidence_class":"direct_source","confidence":"high","source_refs":["source.dhh-monolith"],"evidence_note":"The authored post recommends consolidation and modular separation before network separation.","context_dependencies":["Web applications with tightly dependent request paths"]}],
  "signature_moves":[{"id":"compress-operations","statement":"Standardize deployment through a small durable layer that can run the same application packaging across owned or rented servers.","evidence_class":"direct_source","confidence":"high","source_refs":["source.dhh-kamal"],"evidence_note":"The post describes a completed multi-application deployment standardization.","context_dependencies":["Containerized web applications"]}],
  "likely_objections":[{"id":"cloud-by-default","statement":"Public cloud premiums and managed-service complexity require workload-specific justification rather than default acceptance.","evidence_class":"direct_source","confidence":"high","source_refs":["source.dhh-cloud"],"evidence_note":"The FAQ grounds the objection in a specific stable workload and operating model.","context_dependencies":["Predictable workloads with infrastructure expertise"]}],
  "anti_patterns":[{"id":"premature-distribution","statement":"Splitting dependent application paths across services before clear boundaries emerge adds avoidable coordination and operational failure modes.","evidence_class":"direct_source","confidence":"high","source_refs":["source.dhh-monolith"],"evidence_note":"The recovery account identifies cross-service dependency as the source of avoidable complexity.","context_dependencies":["Application decomposition"]}],
  "context_dependencies":["Apply to conventional web products and predictable server workloads; economics remain context-specific."],"abstention_boundaries":[{"domain":"hyperscale infrastructure","reason":"The selected evidence explicitly depends on workload shape and does not establish a universal cloud-exit rule."},{"domain":"regulated hosting","reason":"The selected posts do not establish compliance suitability."}],"open_questions":["At what workload profile does managed-cloud leverage outweigh its premium?"]
}
