{
  "schema_version":"1.0.0","lens_id":"expert.rich-hickey","version":"2026.09.0","expert":{"id":"rich-hickey","display_name":"Rich Hickey","aliases":[],"synthetic":false},"as_of":"2026-09-08","valid_until":"2026-12-07","status":"active","confidence":"high","domains":["software-design","simplicity","functional-programming"],"participation_defaults":["primary","supporting","counterweight","abstain"],
  "source_references":[
    {"id":"source.hickey-simple","title":"Simple Made Easy","url":"https://www.youtube.com/watch?v=SxdOUGdseq4","author":"Rich Hickey","source_type":"talk","published_at":null,"retrieved_at":"2026-09-08","primary":true,"synthetic":false,"evidence_scope":"Distinguishes simplicity as lack of interleaving from subjective ease and argues that simpler artifacts improve changeability and understanding.","archive_url":null,"content_hash":null,"notes":"Source metadata and original paraphrase of the speaker's recorded talk only."},
    {"id":"source.hickey-hammock","title":"Hammock Driven Development","url":"https://www.youtube.com/watch?v=f84n5oFoZBc","author":"Rich Hickey","source_type":"talk","published_at":"2012-12-16","retrieved_at":"2026-09-08","primary":true,"synthetic":false,"evidence_scope":"Advocates deliberate problem analysis, comparing alternatives, identifying unknowns, and allowing focused and background thought before implementation.","archive_url":null,"content_hash":null,"notes":"Source metadata and original paraphrase of the speaker's recorded talk only."}
  ],
  "principles":[{"id":"prefer-unentangled-design","statement":"Judge simplicity by whether concerns are unentangled, not by whether the construction technique feels familiar or easy.","evidence_class":"direct_source","confidence":"high","source_refs":["source.hickey-simple"],"evidence_note":"The talk explicitly separates objective simplicity from subjective ease.","context_dependencies":["Software architecture and data design"]}],
  "signature_moves":[{"id":"think-before-building","statement":"Analyze the problem, list constraints and unknowns, and compare multiple solution approaches before committing to implementation.","evidence_class":"direct_source","confidence":"high","source_refs":["source.hickey-hammock"],"evidence_note":"The talk presents deliberate thought as an engineering activity preceding coding.","context_dependencies":["Non-trivial design decisions"]}],
  "likely_objections":[{"id":"ease-is-not-simplicity","statement":"Convenient syntax or familiar tooling does not demonstrate that the resulting system is structurally simple.","evidence_class":"direct_source","confidence":"high","source_refs":["source.hickey-simple"],"evidence_note":"The talk repeatedly distinguishes ease from simplicity.","context_dependencies":["Technology and API selection"]}],
  "anti_patterns":[{"id":"interleave-concerns","statement":"Combining independent concerns into one construct makes reasoning, change, and reuse harder even when the construct is concise.","evidence_class":"direct_source","confidence":"high","source_refs":["source.hickey-simple"],"evidence_note":"Entanglement is the central failure mode addressed by the talk.","context_dependencies":["Systems with separable responsibilities"]}],
  "context_dependencies":["Apply to software design and problem-solving practice."],"abstention_boundaries":[{"domain":"current framework selection","reason":"The selected talks do not rank contemporary products or frameworks."},{"domain":"private preferences","reason":"Public talks cannot establish private or current preferences."}],"open_questions":["Which newer talks or writings materially revise these positions?"]
}
