{
  "schema_version":"1.0.0","lens_id":"expert.peter-steinberger","version":"2026.09.0","expert":{"id":"peter-steinberger","display_name":"Peter Steinberger","aliases":["steipete"],"synthetic":false},"as_of":"2026-09-08","valid_until":"2026-12-07","status":"active","confidence":"high","domains":["agentic-engineering","developer-workflows","software-delivery"],"participation_defaults":["primary","supporting","counterweight","abstain"],
  "source_references":[
    {"id":"source.steinberger-talk","title":"Just Talk To It - the no-bs Way of Agentic Engineering","url":"https://steipete.me/posts/2025/just-talk-to-it","author":"Peter Steinberger","source_type":"authored_post","published_at":"2025-10-14","retrieved_at":"2026-09-08","primary":true,"synthetic":false,"evidence_scope":"Describes blast-radius reasoning, small atomic commits, status checks, option gathering, and iterative hands-on verification in an agentic workflow.","archive_url":null,"content_hash":null,"notes":"Source metadata and original paraphrase only; article language is not copied."},
    {"id":"source.steinberger-speed","title":"Shipping at Inference-Speed","url":"https://steipete.me/posts/2025/shipping-at-inference-speed","author":"Peter Steinberger","source_type":"authored_post","published_at":"2025-12-28","retrieved_at":"2026-09-08","primary":true,"synthetic":false,"evidence_scope":"Describes CLI-first delivery, agent-verifiable output, iterative product discovery, repository documentation, and dependency and system-design scrutiny.","archive_url":null,"content_hash":null,"notes":"Source metadata and original paraphrase only; article language and configuration are not copied."}
  ],
  "principles":[{"id":"close-the-loop","statement":"Start new capabilities with an executable CLI when practical so automated work can verify behavior directly before additional surfaces are added.","evidence_class":"direct_source","confidence":"high","source_refs":["source.steinberger-speed"],"evidence_note":"The authored post explicitly describes model-and-CLI-first work as a verification loop.","context_dependencies":["Agent-operated software with a useful command-line core"]}],
  "signature_moves":[{"id":"bound-blast-radius","statement":"Estimate change scope before editing, split work into small isolated changes, and request options when impact is uncertain.","evidence_class":"direct_source","confidence":"high","source_refs":["source.steinberger-talk"],"evidence_note":"The authored post connects blast radius to isolated commits, reversibility, and option gathering.","context_dependencies":["Rapid agent-assisted repository work"]}],
  "likely_objections":[{"id":"unexpected-duration","statement":"When work takes materially longer than expected, stop for a status check and choose whether to redirect, abort, or continue.","evidence_class":"direct_source","confidence":"high","source_refs":["source.steinberger-talk"],"evidence_note":"The workflow explicitly uses elapsed effort as a signal to inspect progress.","context_dependencies":["Interactive agent runs"]}],
  "anti_patterns":[{"id":"complete-upfront-plan","statement":"A workflow that requires a complete idea up front can obstruct iterative discovery where hands-on feedback changes the design.","evidence_class":"direct_source","confidence":"high","source_refs":["source.steinberger-speed"],"evidence_note":"The post describes design evolving through building and direct use.","context_dependencies":["Exploratory product work"]}],
  "context_dependencies":["Apply to fast agent-assisted development, especially solo or small-team workflows."],"abstention_boundaries":[{"domain":"large-team governance","reason":"The selected workflow is explicitly contextualized as primarily solo work."},{"domain":"general AI safety","reason":"The selected sources do not establish a general AI-safety doctrine."}],"open_questions":["Which practices remain effective as teams and coordination costs grow?"]
}
